{
  "format": "x2-asset-pack",
  "version": 1,
  "name": "My pack",
  "scale": 4,
  "graphics": {
    "0048848ccf64d966-16x12": {
      "png": "sprites/ship.png"
    },
    "01a6be94d61de0e7-16x15": {
      "png": "tiles/wall_03.png",
      "scale": 2,
      "anchor": [
        2,
        0
      ]
    }
  },
  "far": [
    {
      "png": "far/level1.png",
      "scale": 4,
      "lines": [
        "aec612394d830079",
        "dd9b44d08d36e3d1",
        "-"
      ]
    }
  ],
  "palettes": [
    {
      "match": [
        "#000",
        "#000",
        "#000",
        "#000",
        "#000",
        "#000",
        "#000",
        "#000",
        "#000",
        "#000",
        "#000",
        "#000",
        "#000",
        "#000",
        "#000",
        "#000"
      ],
      "colors": [
        "#000000",
        "#000000",
        "#000000",
        "#000000",
        "#000000",
        "#000000",
        "#000000",
        "#000000",
        "#000000",
        "#000000",
        "#000000",
        "#000000",
        "#000000",
        "#000000",
        "#000000",
        "#000000"
      ],
      "layers": [
        "far"
      ]
    }
  ]
}
